{
  "$schema": "../schema.json",
  "app_name": "Google Play Services",
  "package_id": "com.google.android.gms",
  "category": "Utilities & Tools",
  "compatibility_status": "Workaround Required",
  "play_integrity_required": true,
  "tested_wsa_version": "REQUIRES TARGET ENVIRONMENT VERIFICATION",
  "tested_root_flavor": "Magisk Stable",
  "last_tested_date": "REQUIRES TARGET ENVIRONMENT VERIFICATION",
  "workaround_steps": [
    "Included by default in every Emberbird edition (Pico GApps).",
    "On Magisk builds, keep Play Services out of optimization by disabling battery restrictions for the app.",
    "Play Integrity attestation passes only in the MEETS_BASIC_INTEGRITY tier; apps requiring DEVICE or STRONG verdicts remain blocked.",
    "Do not manually update GMS Core from outside the Play Store; mismatched versions break push notifications."
  ],
  "known_issues": "Hardware-backed attestation is unavailable, so BASIC_INTEGRITY is the ceiling; some apps (banking, DRM-heavy) hard-fail on that requirement.",
  "verification_status": "unverified"
}
