{
  "app_name": "YONO SBI",
  "package_id": "com.sbi.lotusintouch",
  "category": "Banking & UPI",
  "compatibility_status": "Workaround Required",
  "play_integrity_required": true,
  "tested_wsa_version": "REQUIRES REPOSITORY VERIFICATION",
  "tested_root_flavor": "Magisk Stable",
  "last_tested_date": "REQUIRES REPOSITORY VERIFICATION",
  "workaround_steps": [
    "Disable Developer Options & USB Debugging in WSA Advanced Settings.",
    "Install Shamiko module in Magisk.",
    "Add YONO SBI to DenyList (with Shamiko in blacklist mode).",
    "Ensure PlayIntegrityFix module passes MEETS_DEVICE_INTEGRITY."
  ],
  "known_issues": "App immediately terminates if test-keys or ADB port is open.",
  "verification_status": "unverified"
}
